{
  "schema_version": "1.0",
  "experiment_id": "asd_060_persistence_tree_set_verifier",
  "stage_id": "portfolio_scaffold",
  "status": "blocked",
  "completed_at": "2026-07-31T00:00:00Z",
  "summary": "Execution is blocked until ASD-000 is go; learned stages later wait for terminal ASD-040 evidence.",
  "checks": [
    {
      "id": "plan_authored",
      "status": "passed",
      "detail": "The oracle-first persistence-tree package was authored without computing an oracle or training a selector."
    },
    {
      "id": "dependencies",
      "status": "blocked",
      "detail": "Locked logits are not yet available. ASD-040 evidence is a later learned-stage gate and does not block the CPU oracle."
    }
  ],
  "artifacts": [],
  "metrics": {},
  "error": null
}
