{
  "schema_version": "1.0",
  "experiment_id": "asd_050_prompt_equivariance_quartet",
  "stage_id": "portfolio_scaffold",
  "status": "blocked",
  "completed_at": "2026-07-31T00:00:00Z",
  "summary": "Execution is blocked until ASD-000 finishes with outcome go.",
  "checks": [
    {
      "id": "plan_authored",
      "status": "passed",
      "detail": "The exact LR quartet experiment package was authored without running training."
    },
    {
      "id": "dependency",
      "status": "blocked",
      "detail": "The locked lineage, cohorts, prompt ontology, and error atlas are not yet verified."
    }
  ],
  "artifacts": [],
  "metrics": {},
  "error": null
}
