{
  "schema_version": "1.0",
  "experiment_id": "asd_020_factorial_pathology_anatomy_binding",
  "stage_id": "implement_factorial_binding_pipeline",
  "status": "blocked",
  "completed_at": "2026-07-31T00:00:00Z",
  "summary": "Initialization sentinel; execution is dependency-blocked.",
  "checks": [],
  "artifacts": [],
  "metrics": {},
  "error": {"code":"dependency_blocked","message":"asd_000_evidence_lock_error_atlas must finish with outcome go."}
}
